<?xml version="1.0"?>
<!DOCTYPE Report
[
<!ELEMENT Report (General ,(Doc|BPT)) >
<!ATTLIST Report ver CDATA #REQUIRED tmZone CDATA #REQUIRED>

<!ELEMENT General ( DocLocation ) >
<!ATTLIST General productName CDATA #REQUIRED productVer CDATA #REQUIRED os CDATA #REQUIRED host CDATA #REQUIRED qcserver CDATA #IMPLIED qcproject CDATA #IMPLIED SolManSolutionId CDATA #IMPLIED SolManProjectId CDATA #IMPLIED SolManTestPlanId CDATA #IMPLIED SolManTestPackageId CDATA #IMPLIED SolManUserInfoData CDATA #IMPLIED  >

<!ELEMENT BPT (DName,Res,DVer?,TSet?,TInst?,NodeArgs,AdditionalInfo*,Doc*) >
<!ATTLIST BPT rID ID #REQUIRED >

<!ELEMENT Doc (DName,ConfName?,Res,DVer?,TSet?,TInst?,RunType?,DT?,AdditionalInfo*,Step*,DIter*,Step*,Action*,Doc*,Summary?,TestMaintenanceSummary*,NodeArgs?) >
<!ATTLIST Doc rID ID #REQUIRED type (Test|BC|BPTWrapperTest|Flow|Group|Action) "Test" productName CDATA #REQUIRED BCIter CDATA #IMPLIED >

<!ELEMENT RunType ( #PCDATA )>
<!ATTLIST RunType fmStep (False|True) "False" batch (False|True) "False" upDesc (False|True) "False" upChk (False|True) "False" upAS (False|True) "False">

<!ELEMENT DName ( #PCDATA ) >

<!ELEMENT ConfName ( #PCDATA ) >

<!ELEMENT Res ( #PCDATA ) >

<!ELEMENT AdditionalInfo (AdditionalDataName,AdditionalDataValue ) >

<!ELEMENT AdditionalDataName ( #PCDATA ) >

<!ELEMENT AdditionalDataValue ( #PCDATA ) >

<!ELEMENT DVer ( #PCDATA ) >

<!ELEMENT TSet ( #PCDATA ) >

<!ELEMENT TInst ( #PCDATA ) >

<!ELEMENT DIter (Step*,Action+,Summary?,NodeArgs)>
<!ATTLIST DIter rID ID #REQUIRED iterID CDATA #REQUIRED>

<!ELEMENT DocLocation ( #PCDATA )>

<!ELEMENT Action (AName,AIter*,(Step|HtmlStep|Action)*, Summary,ActionMaintenanceSummary*, NodeArgs ) >
<!ATTLIST Action rID ID #REQUIRED>

<!ELEMENT AIter ((Step|HtmlStep|Action)*,DataMapping?, Summary?,NodeArgs) >
<!ATTLIST AIter rID ID #REQUIRED iterID CDATA #REQUIRED isCountable (False|True) "False" >

<!ELEMENT AName ( #PCDATA ) >

<!ELEMENT TestMaintenanceSummary (ActionMaintenanceSummary*) >
<!ATTLIST TestMaintenanceSummary ObjectsAdded CDATA #REQUIRED ObjectsUpdated CDATA #REQUIRED StepsUpdated CDATA #REQUIRED StepsComments CDATA #REQUIRED><!ELEMENT ActionMaintenanceSummary (ObjectChange* ) >
<!ATTLIST ActionMaintenanceSummary Action CDATA #REQUIRED Objects CDATA #REQUIRED Updated CDATA #REQUIRED LinesTotal CDATA #REQUIRED Added CDATA #REQUIRED LinesUpdated CDATA #REQUIRED>

<!ELEMENT ObjectChange  (Hierarchy, PropertyChangeList* ) >
<!ATTLIST ObjectChange Operation CDATA #IMPLIED OriginalRepository CDATA #IMPLIED>

<!ELEMENT PropertyChangeList (PropertyDef*) >

<!ELEMENT PropertyDef (OriginalValue, NewValue) >
<!ATTLIST PropertyDef PropName CDATA #REQUIRED OriginRegularExpression (True|False) "False" NewRegularExpression (True|False) "False" AddedProperty (True|False) "False" >

<!ELEMENT OriginalValue ( #PCDATA )>

<!ELEMENT NewValue ( #PCDATA )>

<!ELEMENT Hierarchy  (ObjectName, Hierarchy*) >
<!ATTLIST Hierarchy MicClass CDATA #REQUIRED>

<!ELEMENT ObjectName  ( #PCDATA ) >

<!ELEMENT Step (Obj,Details,Time,TimeTick* ,(Step|HtmlStep|Doc)*, DataMapping?, NodeArgs) >
<!ATTLIST Step rID ID #REQUIRED retval CDATA #IMPLIED>

<!ELEMENT HtmlStep (HTML,TimeTick*,(Step|HtmlStep|Doc)*,NodeArgs) >
<!ATTLIST HtmlStep rID ID #REQUIRED >

<!ELEMENT Obj ( #PCDATA ) >
<!ATTLIST Obj plainTxt (False|True) "True">

<!ELEMENT Details ( #PCDATA ) >
<!ATTLIST Details plainTxt (False|True) "True">

<!ELEMENT Time ( #PCDATA ) >

<!ELEMENT HTML ( #PCDATA ) >

<!ELEMENT Disp ( #PCDATA ) >

<!ELEMENT TimeTick ( #PCDATA ) >

<!ELEMENT DataMapping ( DataMappedItem* )>
<!ELEMENT DataMappedItem EMPTY >
<!ATTLIST DataMappedItem dsName CDATA #REQUIRED >
<!ATTLIST DataMappedItem rowId CDATA #REQUIRED >

<!ELEMENT NodeArgs (Disp,TopPane?,BtmPane?,ExtendedInfo? )>
<!ATTLIST NodeArgs eType CDATA #REQUIRED icon CDATA #REQUIRED nRep CDATA #REQUIRED UserNote CDATA #IMPLIED filter (False|True) "True">
<!ATTLIST NodeArgs status (Passed|Failed|Done|Warning|Information) "Done">
<!ATTLIST NodeArgs iconSel CDATA #IMPLIED nType CDATA #IMPLIED MovieMarker CDATA "">
<!ATTLIST NodeArgs Source CDATA #IMPLIED SourceLine CDATA #IMPLIED StepFlowItemKey CDATA #IMPLIED >

<!ELEMENT TopPane (Path)>

<!ELEMENT BtmPane ( (Path|WR)?,ASHilite?)>
<!ATTLIST BtmPane vType CDATA "HTML">

<!ELEMENT Path ( #PCDATA ) >

<!ELEMENT ASHilite ( #PCDATA ) >

<!ELEMENT WR ( #PCDATA ) >

<!ELEMENT ExtendedInfo ( StepData ) >

<!ATTLIST ExtendedInfo StepType CDATA #REQUIRED>
<!ELEMENT DT (NodeArgs) >
<!ATTLIST DT rID ID #REQUIRED>

<!ELEMENT Summary (Param*)>
<!ATTLIST Summary sTime CDATA #IMPLIED eTime CDATA #IMPLIED passed CDATA #IMPLIED failed CDATA #IMPLIED warnings CDATA #IMPLIED retval CDATA #IMPLIED stopped (False|True) "False" >

<!ELEMENT Param (ParamName,ParamVal)+ >
<!ATTLIST Param paramInOut (In|Out) "In">

<!ELEMENT ParamName ( #PCDATA ) >

<!ELEMENT ParamVal ( #PCDATA ) >

]
>
<Report ver="2.0" tmZone="India Standard Time">
<General productName="HPE Unified Functional Testing" productVer="14.03" os="" host="DIKSHA"><DocLocation><![CDATA[D:\KeywordDrivenFramework\Driver\Driver]]></DocLocation></General>
<Doc rID="T1"   productName= "HPE Unified Functional Testing"  >
<DName><![CDATA[Driver]]></DName>
<Res><![CDATA[Res44]]></Res>
<DT rID="T2">
<NodeArgs eType="Table" icon="2" nRep="4" filter="False" >
<Disp><![CDATA[Run-Time Data Table]]></Disp>
<BtmPane vType="Table" >
<Path><![CDATA[Default.xls]]></Path>
</BtmPane>
</NodeArgs>
</DT>
<Action rID="T3">
<AName><![CDATA[Action1]]></AName>
<Step rID="T4">
<Obj plainTxt="False" ><![CDATA[tr1]]></Obj>
<Details plainTxt="False" ><![CDATA[Transaction "tr1" started.]]></Details>
<Time><![CDATA[29/03/2022 - 23:01:38]]></Time>
<TimeTick>1648575098</TimeTick>
<NodeArgs eType="Transaction" icon="4" nRep="7" nType="Start Transaction" Source="Action1" SourceLine="5" >
<Disp><![CDATA[tr1]]></Disp>
</NodeArgs>
</Step>
<Step rID="T5">
<Obj plainTxt="False" ><![CDATA[Run Error]]></Obj>
<Details plainTxt="False" ><![CDATA[Type mismatch: 'Enviornment'<BR/>Function file: D:\KeywordDrivenFramework\FunctionLibr\Library2.qfl<BR/>Line (3): &quot;Systemutil.Run(Enviornment(&quot;flightpath&quot;))&quot;.]]></Details>
<Time><![CDATA[29/03/2022 - 23:01:47]]></Time>
<TimeTick>1648575107</TimeTick>
<NodeArgs eType="Replay" icon="5" nRep="8" status="Failed" Source="D:\KeywordDrivenFramework\FunctionLibr\Library2.qfl" SourceLine="2" >
<Disp><![CDATA[Run Error]]></Disp>
</NodeArgs>
</Step>
<Step rID="T6">
<Obj plainTxt="False" ><![CDATA[HPE MyFlight Sample Applicatio]]></Obj>
<Details plainTxt="False" ><![CDATA[WpfWindow]]></Details>
<Time><![CDATA[29/03/2022 - 23:02:29]]></Time>
<TimeTick>1648575149</TimeTick>
<Step rID="T7">
<Obj plainTxt="False" ><![CDATA[agentName]]></Obj>
<Details plainTxt="False" ><![CDATA[Cannot&nbsp;find&nbsp;the&nbsp;"agentName"&nbsp;object's&nbsp;parent&nbsp;"HPE&nbsp;MyFlight&nbsp;Sample&nbsp;Applicatio"&nbsp;(class&nbsp;WpfWindow).<br/>Verify&nbsp;that&nbsp;parent&nbsp;properties&nbsp;match&nbsp;an&nbsp;object&nbsp;currently&nbsp;displayed&nbsp;in&nbsp;your&nbsp;application.]]></Details>
<Time><![CDATA[29/03/2022 - 23:02:29]]></Time>
<TimeTick>1648575149</TimeTick>
<Step rID="T8">
<Obj plainTxt="False" ><![CDATA[HPE MyFlight Sample Applicatio]]></Obj>
<Details plainTxt="False" ><![CDATA[Object's physical description:<br>wpftypename = window<br>regexpwndtitle = HPE MyFlight Sample Application<br>devname = HPE MyFlight Sample Application<br>]]></Details>
<Time><![CDATA[29/03/2022 - 23:02:29]]></Time>
<TimeTick>1648575149</TimeTick>
<NodeArgs eType="Replay" icon="5" nRep="31" status="Warning" nType="Parent description" Source="D:\KeywordDrivenFramework\FunctionLibr\Library2.qfl" SourceLine="-1" >
<Disp><![CDATA[HPE MyFlight Sample Applicatio]]></Disp>
</NodeArgs>
</Step>
<NodeArgs eType="Replay" icon="7" nRep="30" status="Failed" nType="Run Error" Source="D:\KeywordDrivenFramework\FunctionLibr\Library2.qfl" SourceLine="-1" >
<Disp><![CDATA[agentName]]></Disp>
</NodeArgs>
</Step>
<NodeArgs eType="Context" icon="6" nRep="29" status="Failed" Source="D:\KeywordDrivenFramework\FunctionLibr\Library2.qfl" SourceLine="-1" >
<Disp><![CDATA[HPE MyFlight Sample Applicatio]]></Disp>
</NodeArgs>
</Step>
<Step rID="T9">
<Obj plainTxt="False" ><![CDATA[HPE MyFlight Sample Applicatio]]></Obj>
<Details plainTxt="False" ><![CDATA[WpfWindow]]></Details>
<Time><![CDATA[29/03/2022 - 23:02:29]]></Time>
<TimeTick>1648575149</TimeTick>
<Step rID="T10">
<Obj plainTxt="False" ><![CDATA[Run Error]]></Obj>
<Details plainTxt="False" ><![CDATA[Cannot find the &quot;agentName&quot; object's parent &quot;HPE MyFlight Sample Applicatio&quot; (class WpfWindow).<BR/>Verify that parent properties match an object currently displayed in your application.<BR/>Function file: D:\KeywordDrivenFramework\FunctionLibr\Library2.qfl<BR/>Line (4): &quot;WpfWindow(&quot;HPE MyFlight Sample Applicatio&quot;).WpfEdit(&quot;agentName&quot;).Set &quot;john&quot;&quot;.]]></Details>
<Time><![CDATA[29/03/2022 - 23:02:29]]></Time>
<TimeTick>1648575149</TimeTick>
<NodeArgs eType="Replay" icon="5" nRep="33" status="Failed" Source="D:\KeywordDrivenFramework\FunctionLibr\Library2.qfl" SourceLine="3" >
<Disp><![CDATA[Run Error]]></Disp>
</NodeArgs>
</Step>
<Step rID="T11">
<Obj plainTxt="False" ><![CDATA[password]]></Obj>
<Details plainTxt="False" ><![CDATA[Cannot&nbsp;find&nbsp;the&nbsp;"password"&nbsp;object's&nbsp;parent&nbsp;"HPE&nbsp;MyFlight&nbsp;Sample&nbsp;Applicatio"&nbsp;(class&nbsp;WpfWindow).<br/>Verify&nbsp;that&nbsp;parent&nbsp;properties&nbsp;match&nbsp;an&nbsp;object&nbsp;currently&nbsp;displayed&nbsp;in&nbsp;your&nbsp;application.]]></Details>
<Time><![CDATA[29/03/2022 - 23:02:51]]></Time>
<TimeTick>1648575171</TimeTick>
<Step rID="T12">
<Obj plainTxt="False" ><![CDATA[HPE MyFlight Sample Applicatio]]></Obj>
<Details plainTxt="False" ><![CDATA[Object's physical description:<br>wpftypename = window<br>regexpwndtitle = HPE MyFlight Sample Application<br>devname = HPE MyFlight Sample Application<br>]]></Details>
<Time><![CDATA[29/03/2022 - 23:02:51]]></Time>
<TimeTick>1648575171</TimeTick>
<NodeArgs eType="Replay" icon="5" nRep="43" status="Warning" nType="Parent description" Source="D:\KeywordDrivenFramework\FunctionLibr\Library2.qfl" SourceLine="-1" >
<Disp><![CDATA[HPE MyFlight Sample Applicatio]]></Disp>
</NodeArgs>
</Step>
<NodeArgs eType="Replay" icon="7" nRep="42" status="Failed" nType="Run Error" Source="D:\KeywordDrivenFramework\FunctionLibr\Library2.qfl" SourceLine="-1" >
<Disp><![CDATA[password]]></Disp>
</NodeArgs>
</Step>
<NodeArgs eType="Context" icon="6" nRep="32" status="Failed" Source="D:\KeywordDrivenFramework\FunctionLibr\Library2.qfl" SourceLine="-1" >
<Disp><![CDATA[HPE MyFlight Sample Applicatio]]></Disp>
</NodeArgs>
</Step>
<Step rID="T13">
<Obj plainTxt="False" ><![CDATA[HPE MyFlight Sample Applicatio]]></Obj>
<Details plainTxt="False" ><![CDATA[WpfWindow]]></Details>
<Time><![CDATA[29/03/2022 - 23:02:51]]></Time>
<TimeTick>1648575171</TimeTick>
<Step rID="T14">
<Obj plainTxt="False" ><![CDATA[Run Error]]></Obj>
<Details plainTxt="False" ><![CDATA[Cannot find the &quot;password&quot; object's parent &quot;HPE MyFlight Sample Applicatio&quot; (class WpfWindow).<BR/>Verify that parent properties match an object currently displayed in your application.<BR/>Function file: D:\KeywordDrivenFramework\FunctionLibr\Library2.qfl<BR/>Line (5): &quot;WpfWindow(&quot;HPE MyFlight Sample Applicatio&quot;).WpfEdit(&quot;password&quot;).SetSecure &quot;6242a97c443fd0b29eca&quot;&quot;.]]></Details>
<Time><![CDATA[29/03/2022 - 23:02:51]]></Time>
<TimeTick>1648575171</TimeTick>
<NodeArgs eType="Replay" icon="5" nRep="45" status="Failed" Source="D:\KeywordDrivenFramework\FunctionLibr\Library2.qfl" SourceLine="4" >
<Disp><![CDATA[Run Error]]></Disp>
</NodeArgs>
</Step>
<Step rID="T15">
<Obj plainTxt="False" ><![CDATA[OK]]></Obj>
<Details plainTxt="False" ><![CDATA[Cannot&nbsp;find&nbsp;the&nbsp;"OK"&nbsp;object's&nbsp;parent&nbsp;"HPE&nbsp;MyFlight&nbsp;Sample&nbsp;Applicatio"&nbsp;(class&nbsp;WpfWindow).<br/>Verify&nbsp;that&nbsp;parent&nbsp;properties&nbsp;match&nbsp;an&nbsp;object&nbsp;currently&nbsp;displayed&nbsp;in&nbsp;your&nbsp;application.]]></Details>
<Time><![CDATA[29/03/2022 - 23:03:14]]></Time>
<TimeTick>1648575194</TimeTick>
<Step rID="T16">
<Obj plainTxt="False" ><![CDATA[HPE MyFlight Sample Applicatio]]></Obj>
<Details plainTxt="False" ><![CDATA[Object's physical description:<br>wpftypename = window<br>regexpwndtitle = HPE MyFlight Sample Application<br>devname = HPE MyFlight Sample Application<br>]]></Details>
<Time><![CDATA[29/03/2022 - 23:03:14]]></Time>
<TimeTick>1648575194</TimeTick>
<NodeArgs eType="Replay" icon="5" nRep="55" status="Warning" nType="Parent description" Source="D:\KeywordDrivenFramework\FunctionLibr\Library2.qfl" SourceLine="-1" >
<Disp><![CDATA[HPE MyFlight Sample Applicatio]]></Disp>
</NodeArgs>
</Step>
<NodeArgs eType="Replay" icon="8" nRep="54" status="Failed" nType="Run Error" Source="D:\KeywordDrivenFramework\FunctionLibr\Library2.qfl" SourceLine="-1" >
<Disp><![CDATA[OK]]></Disp>
</NodeArgs>
</Step>
<NodeArgs eType="Context" icon="6" nRep="44" status="Failed" Source="D:\KeywordDrivenFramework\FunctionLibr\Library2.qfl" SourceLine="-1" >
<Disp><![CDATA[HPE MyFlight Sample Applicatio]]></Disp>
</NodeArgs>
</Step>
<Step rID="T17">
<Obj plainTxt="False" ><![CDATA[HPE MyFlight Sample Applicatio]]></Obj>
<Details plainTxt="False" ><![CDATA[WpfWindow]]></Details>
<Time><![CDATA[29/03/2022 - 23:03:14]]></Time>
<TimeTick>1648575194</TimeTick>
<Step rID="T18">
<Obj plainTxt="False" ><![CDATA[Run Error]]></Obj>
<Details plainTxt="False" ><![CDATA[Cannot find the &quot;OK&quot; object's parent &quot;HPE MyFlight Sample Applicatio&quot; (class WpfWindow).<BR/>Verify that parent properties match an object currently displayed in your application.<BR/>Function file: D:\KeywordDrivenFramework\FunctionLibr\Library2.qfl<BR/>Line (6): &quot;WpfWindow(&quot;HPE MyFlight Sample Applicatio&quot;).WpfButton(&quot;OK&quot;).Click&quot;.]]></Details>
<Time><![CDATA[29/03/2022 - 23:03:14]]></Time>
<TimeTick>1648575194</TimeTick>
<NodeArgs eType="Replay" icon="5" nRep="57" status="Failed" Source="D:\KeywordDrivenFramework\FunctionLibr\Library2.qfl" SourceLine="5" >
<Disp><![CDATA[Run Error]]></Disp>
</NodeArgs>
</Step>
<Step rID="T19">
<Obj plainTxt="False" ><![CDATA[HPE MyFlight Sample Applicatio.Exist]]></Obj>
<Details plainTxt="False" ><![CDATA["Object does not exist"]]></Details>
<Time><![CDATA[29/03/2022 - 23:03:24]]></Time>
<TimeTick>1648575204</TimeTick>
<NodeArgs eType="Replay" icon="6" nRep="59" Source="D:\KeywordDrivenFramework\FunctionLibr\Library2.qfl" SourceLine="-1" >
<Disp><![CDATA[HPE MyFlight Sample Applicatio.Exist]]></Disp>
</NodeArgs>
</Step>
<NodeArgs eType="Context" icon="6" nRep="56" status="Failed" Source="D:\KeywordDrivenFramework\FunctionLibr\Library2.qfl" SourceLine="-1" >
<Disp><![CDATA[HPE MyFlight Sample Applicatio]]></Disp>
</NodeArgs>
</Step>
<Step rID="T20">
<Obj ><![CDATA[Login]]></Obj>
<Details ><![CDATA[Login Unsuccessfull]]></Details>
<Time><![CDATA[29/03/2022 - 23:03:24]]></Time>
<TimeTick>1648575204</TimeTick>
<NodeArgs eType="User" icon="9" nRep="60" status="Failed" Source="D:\KeywordDrivenFramework\FunctionLibr\Library2.qfl" SourceLine="-1" >
<Disp><![CDATA[Login]]></Disp>
</NodeArgs>
</Step>
<Step rID="T21">
<Obj plainTxt="False" ><![CDATA[HPE MyFlight Sample Applicatio]]></Obj>
<Details plainTxt="False" ><![CDATA[WpfWindow]]></Details>
<Time><![CDATA[29/03/2022 - 23:03:49]]></Time>
<TimeTick>1648575229</TimeTick>
<Step rID="T22">
<Obj plainTxt="False" ><![CDATA[HPE MyFlight Sample Applicatio]]></Obj>
<Details plainTxt="False" ><![CDATA[Cannot&nbsp;identify&nbsp;the&nbsp;object&nbsp;"HPE&nbsp;MyFlight&nbsp;Sample&nbsp;Applicatio"&nbsp;(of&nbsp;class&nbsp;WpfWindow).<br/>Verify&nbsp;that&nbsp;this&nbsp;object's&nbsp;properties&nbsp;match&nbsp;an&nbsp;object&nbsp;currently&nbsp;displayed&nbsp;in&nbsp;your&nbsp;application.]]></Details>
<Time><![CDATA[29/03/2022 - 23:03:49]]></Time>
<TimeTick>1648575229</TimeTick>
<Step rID="T23">
<Obj plainTxt="False" ><![CDATA[HPE MyFlight Sample Applicatio]]></Obj>
<Details plainTxt="False" ><![CDATA[Object's physical description:<br>wpftypename = window<br>regexpwndtitle = HPE MyFlight Sample Application<br>devname = HPE MyFlight Sample Application<br>]]></Details>
<Time><![CDATA[29/03/2022 - 23:03:49]]></Time>
<TimeTick>1648575229</TimeTick>
<NodeArgs eType="Replay" icon="5" nRep="65" status="Warning" nType="Description" >
<Disp><![CDATA[HPE MyFlight Sample Applicatio]]></Disp>
</NodeArgs>
</Step>
<NodeArgs eType="Replay" icon="6" nRep="64" status="Failed" nType="Run Error" >
<Disp><![CDATA[HPE MyFlight Sample Applicatio]]></Disp>
</NodeArgs>
</Step>
<NodeArgs eType="Context" icon="6" nRep="63" status="Failed" >
<Disp><![CDATA[HPE MyFlight Sample Applicatio]]></Disp>
</NodeArgs>
</Step>
<Step rID="T24">
<Obj plainTxt="False" ><![CDATA[HPE MyFlight Sample Applicatio]]></Obj>
<Details plainTxt="False" ><![CDATA[WpfWindow]]></Details>
<Time><![CDATA[29/03/2022 - 23:03:49]]></Time>
<TimeTick>1648575229</TimeTick>
<Step rID="T25">
<Obj plainTxt="False" ><![CDATA[Run Error]]></Obj>
<Details plainTxt="False" ><![CDATA[Cannot identify the object &quot;HPE MyFlight Sample Applicatio&quot; (of class WpfWindow).<BR/>Verify that this object's properties match an object currently displayed in your application.<BR/>Function file: D:\KeywordDrivenFramework\FunctionLibr\Library2.qfl<BR/>Line (17): &quot;WpfWindow(&quot;HPE MyFlight Sample Applicatio&quot;).Close&quot;.]]></Details>
<Time><![CDATA[29/03/2022 - 23:03:49]]></Time>
<TimeTick>1648575229</TimeTick>
<NodeArgs eType="Replay" icon="5" nRep="67" status="Failed" Source="D:\KeywordDrivenFramework\FunctionLibr\Library2.qfl" SourceLine="16" >
<Disp><![CDATA[Run Error]]></Disp>
</NodeArgs>
</Step>
<Step rID="T26">
<Obj plainTxt="False" ><![CDATA[HPE MyFlight Sample Applicatio]]></Obj>
<Details plainTxt="False" ><![CDATA[Cannot&nbsp;identify&nbsp;the&nbsp;object&nbsp;"HPE&nbsp;MyFlight&nbsp;Sample&nbsp;Applicatio"&nbsp;(of&nbsp;class&nbsp;WpfWindow).<br/>Verify&nbsp;that&nbsp;this&nbsp;object's&nbsp;properties&nbsp;match&nbsp;an&nbsp;object&nbsp;currently&nbsp;displayed&nbsp;in&nbsp;your&nbsp;application.]]></Details>
<Time><![CDATA[29/03/2022 - 23:03:49]]></Time>
<TimeTick>1648575229</TimeTick>
<Step rID="T27">
<Obj plainTxt="False" ><![CDATA[HPE MyFlight Sample Applicatio]]></Obj>
<Details plainTxt="False" ><![CDATA[Object's physical description:<br>wpftypename = window<br>regexpwndtitle = HPE MyFlight Sample Application<br>devname = HPE MyFlight Sample Application<br>]]></Details>
<Time><![CDATA[29/03/2022 - 23:03:49]]></Time>
<TimeTick>1648575229</TimeTick>
<NodeArgs eType="Replay" icon="5" nRep="69" status="Warning" nType="Description" Source="D:\KeywordDrivenFramework\FunctionLibr\Library2.qfl" SourceLine="-1" >
<Disp><![CDATA[HPE MyFlight Sample Applicatio]]></Disp>
</NodeArgs>
</Step>
<NodeArgs eType="Replay" icon="6" nRep="68" status="Failed" nType="Run Error" Source="D:\KeywordDrivenFramework\FunctionLibr\Library2.qfl" SourceLine="-1" >
<Disp><![CDATA[HPE MyFlight Sample Applicatio]]></Disp>
</NodeArgs>
</Step>
<Step rID="T28">
<Obj plainTxt="False" ><![CDATA[HPE MyFlight Sample Applicatio.Exist]]></Obj>
<Details plainTxt="False" ><![CDATA["Object does not exist"]]></Details>
<Time><![CDATA[29/03/2022 - 23:03:59]]></Time>
<TimeTick>1648575239</TimeTick>
<NodeArgs eType="Replay" icon="6" nRep="71" Source="D:\KeywordDrivenFramework\FunctionLibr\Library2.qfl" SourceLine="-1" >
<Disp><![CDATA[HPE MyFlight Sample Applicatio.Exist]]></Disp>
</NodeArgs>
</Step>
<NodeArgs eType="Context" icon="6" nRep="66" status="Failed" Source="D:\KeywordDrivenFramework\FunctionLibr\Library2.qfl" SourceLine="-1" >
<Disp><![CDATA[HPE MyFlight Sample Applicatio]]></Disp>
</NodeArgs>
</Step>
<Step rID="T29">
<Obj ><![CDATA[CloseApp]]></Obj>
<Details ><![CDATA[CloseApp Successfull]]></Details>
<Time><![CDATA[29/03/2022 - 23:03:59]]></Time>
<TimeTick>1648575239</TimeTick>
<NodeArgs eType="User" icon="9" nRep="72" status="Passed" Source="D:\KeywordDrivenFramework\FunctionLibr\Library2.qfl" SourceLine="-1" >
<Disp><![CDATA[CloseApp]]></Disp>
</NodeArgs>
</Step>
<Step rID="T30">
<Obj plainTxt="False" ><![CDATA[Run Error]]></Obj>
<Details plainTxt="False" ><![CDATA[Type mismatch: 'Enviornment'<BR/>Function file: D:\KeywordDrivenFramework\FunctionLibr\Library2.qfl<BR/>Line (3): &quot;Systemutil.Run(Enviornment(&quot;flightpath&quot;))&quot;.]]></Details>
<Time><![CDATA[29/03/2022 - 23:04:15]]></Time>
<TimeTick>1648575255</TimeTick>
<NodeArgs eType="Replay" icon="5" nRep="73" status="Failed" Source="D:\KeywordDrivenFramework\FunctionLibr\Library2.qfl" SourceLine="2" >
<Disp><![CDATA[Run Error]]></Disp>
</NodeArgs>
</Step>
<Step rID="T31">
<Obj plainTxt="False" ><![CDATA[HPE MyFlight Sample Applicatio]]></Obj>
<Details plainTxt="False" ><![CDATA[WpfWindow]]></Details>
<Time><![CDATA[29/03/2022 - 23:04:15]]></Time>
<TimeTick>1648575255</TimeTick>
<Step rID="T32">
<Obj plainTxt="False" ><![CDATA[agentName]]></Obj>
<Details plainTxt="False" ><![CDATA[Cannot&nbsp;find&nbsp;the&nbsp;"agentName"&nbsp;object's&nbsp;parent&nbsp;"HPE&nbsp;MyFlight&nbsp;Sample&nbsp;Applicatio"&nbsp;(class&nbsp;WpfWindow).<br/>Verify&nbsp;that&nbsp;parent&nbsp;properties&nbsp;match&nbsp;an&nbsp;object&nbsp;currently&nbsp;displayed&nbsp;in&nbsp;your&nbsp;application.]]></Details>
<Time><![CDATA[29/03/2022 - 23:04:15]]></Time>
<TimeTick>1648575255</TimeTick>
<Step rID="T33">
<Obj plainTxt="False" ><![CDATA[HPE MyFlight Sample Applicatio]]></Obj>
<Details plainTxt="False" ><![CDATA[Object's physical description:<br>wpftypename = window<br>regexpwndtitle = HPE MyFlight Sample Application<br>devname = HPE MyFlight Sample Application<br>]]></Details>
<Time><![CDATA[29/03/2022 - 23:04:15]]></Time>
<TimeTick>1648575255</TimeTick>
<NodeArgs eType="Replay" icon="5" nRep="76" status="Warning" nType="Parent description" Source="D:\KeywordDrivenFramework\FunctionLibr\Library2.qfl" SourceLine="-1" >
<Disp><![CDATA[HPE MyFlight Sample Applicatio]]></Disp>
</NodeArgs>
</Step>
<NodeArgs eType="Replay" icon="7" nRep="75" status="Failed" nType="Run Error" Source="D:\KeywordDrivenFramework\FunctionLibr\Library2.qfl" SourceLine="-1" >
<Disp><![CDATA[agentName]]></Disp>
</NodeArgs>
</Step>
<Step rID="T34">
<Obj plainTxt="False" ><![CDATA[agentName]]></Obj>
<Details plainTxt="False" ><![CDATA[Cannot&nbsp;find&nbsp;the&nbsp;"agentName"&nbsp;object's&nbsp;parent&nbsp;"HPE&nbsp;MyFlight&nbsp;Sample&nbsp;Applicatio"&nbsp;(class&nbsp;WpfWindow).<br/>Verify&nbsp;that&nbsp;parent&nbsp;properties&nbsp;match&nbsp;an&nbsp;object&nbsp;currently&nbsp;displayed&nbsp;in&nbsp;your&nbsp;application.]]></Details>
<Time><![CDATA[29/03/2022 - 23:04:37]]></Time>
<TimeTick>1648575277</TimeTick>
<Step rID="T35">
<Obj plainTxt="False" ><![CDATA[HPE MyFlight Sample Applicatio]]></Obj>
<Details plainTxt="False" ><![CDATA[Object's physical description:<br>wpftypename = window<br>regexpwndtitle = HPE MyFlight Sample Application<br>devname = HPE MyFlight Sample Application<br>]]></Details>
<Time><![CDATA[29/03/2022 - 23:04:37]]></Time>
<TimeTick>1648575277</TimeTick>
<NodeArgs eType="Replay" icon="5" nRep="86" status="Warning" nType="Parent description" Source="D:\KeywordDrivenFramework\FunctionLibr\Library2.qfl" SourceLine="-1" >
<Disp><![CDATA[HPE MyFlight Sample Applicatio]]></Disp>
</NodeArgs>
</Step>
<NodeArgs eType="Replay" icon="7" nRep="85" status="Failed" nType="Run Error" Source="D:\KeywordDrivenFramework\FunctionLibr\Library2.qfl" SourceLine="-1" >
<Disp><![CDATA[agentName]]></Disp>
</NodeArgs>
</Step>
<NodeArgs eType="Context" icon="6" nRep="74" status="Failed" Source="D:\KeywordDrivenFramework\FunctionLibr\Library2.qfl" SourceLine="-1" >
<Disp><![CDATA[HPE MyFlight Sample Applicatio]]></Disp>
</NodeArgs>
</Step>
<Step rID="T36">
<Obj plainTxt="False" ><![CDATA[HPE MyFlight Sample Applicatio]]></Obj>
<Details plainTxt="False" ><![CDATA[WpfWindow]]></Details>
<Time><![CDATA[29/03/2022 - 23:04:37]]></Time>
<TimeTick>1648575277</TimeTick>
<Step rID="T37">
<Obj plainTxt="False" ><![CDATA[Run Error]]></Obj>
<Details plainTxt="False" ><![CDATA[Cannot find the &quot;agentName&quot; object's parent &quot;HPE MyFlight Sample Applicatio&quot; (class WpfWindow).<BR/>Verify that parent properties match an object currently displayed in your application.<BR/>Function file: D:\KeywordDrivenFramework\FunctionLibr\Library2.qfl<BR/>Line (4): &quot;WpfWindow(&quot;HPE MyFlight Sample Applicatio&quot;).WpfEdit(&quot;agentName&quot;).Set &quot;john&quot;&quot;.]]></Details>
<Time><![CDATA[29/03/2022 - 23:04:37]]></Time>
<TimeTick>1648575277</TimeTick>
<NodeArgs eType="Replay" icon="5" nRep="88" status="Failed" Source="D:\KeywordDrivenFramework\FunctionLibr\Library2.qfl" SourceLine="3" >
<Disp><![CDATA[Run Error]]></Disp>
</NodeArgs>
</Step>
<Step rID="T38">
<Obj plainTxt="False" ><![CDATA[password]]></Obj>
<Details plainTxt="False" ><![CDATA[Cannot&nbsp;find&nbsp;the&nbsp;"password"&nbsp;object's&nbsp;parent&nbsp;"HPE&nbsp;MyFlight&nbsp;Sample&nbsp;Applicatio"&nbsp;(class&nbsp;WpfWindow).<br/>Verify&nbsp;that&nbsp;parent&nbsp;properties&nbsp;match&nbsp;an&nbsp;object&nbsp;currently&nbsp;displayed&nbsp;in&nbsp;your&nbsp;application.]]></Details>
<Time><![CDATA[29/03/2022 - 23:04:37]]></Time>
<TimeTick>1648575277</TimeTick>
<Step rID="T39">
<Obj plainTxt="False" ><![CDATA[HPE MyFlight Sample Applicatio]]></Obj>
<Details plainTxt="False" ><![CDATA[Object's physical description:<br>wpftypename = window<br>regexpwndtitle = HPE MyFlight Sample Application<br>devname = HPE MyFlight Sample Application<br>]]></Details>
<Time><![CDATA[29/03/2022 - 23:04:37]]></Time>
<TimeTick>1648575277</TimeTick>
<NodeArgs eType="Replay" icon="5" nRep="90" status="Warning" nType="Parent description" Source="D:\KeywordDrivenFramework\FunctionLibr\Library2.qfl" SourceLine="-1" >
<Disp><![CDATA[HPE MyFlight Sample Applicatio]]></Disp>
</NodeArgs>
</Step>
<NodeArgs eType="Replay" icon="7" nRep="89" status="Failed" nType="Run Error" Source="D:\KeywordDrivenFramework\FunctionLibr\Library2.qfl" SourceLine="-1" >
<Disp><![CDATA[password]]></Disp>
</NodeArgs>
</Step>
<Step rID="T40">
<Obj plainTxt="False" ><![CDATA[password]]></Obj>
<Details plainTxt="False" ><![CDATA[Cannot&nbsp;find&nbsp;the&nbsp;"password"&nbsp;object's&nbsp;parent&nbsp;"HPE&nbsp;MyFlight&nbsp;Sample&nbsp;Applicatio"&nbsp;(class&nbsp;WpfWindow).<br/>Verify&nbsp;that&nbsp;parent&nbsp;properties&nbsp;match&nbsp;an&nbsp;object&nbsp;currently&nbsp;displayed&nbsp;in&nbsp;your&nbsp;application.]]></Details>
<Time><![CDATA[29/03/2022 - 23:04:59]]></Time>
<TimeTick>1648575299</TimeTick>
<Step rID="T41">
<Obj plainTxt="False" ><![CDATA[HPE MyFlight Sample Applicatio]]></Obj>
<Details plainTxt="False" ><![CDATA[Object's physical description:<br>wpftypename = window<br>regexpwndtitle = HPE MyFlight Sample Application<br>devname = HPE MyFlight Sample Application<br>]]></Details>
<Time><![CDATA[29/03/2022 - 23:04:59]]></Time>
<TimeTick>1648575299</TimeTick>
<NodeArgs eType="Replay" icon="5" nRep="100" status="Warning" nType="Parent description" Source="D:\KeywordDrivenFramework\FunctionLibr\Library2.qfl" SourceLine="-1" >
<Disp><![CDATA[HPE MyFlight Sample Applicatio]]></Disp>
</NodeArgs>
</Step>
<NodeArgs eType="Replay" icon="7" nRep="99" status="Failed" nType="Run Error" Source="D:\KeywordDrivenFramework\FunctionLibr\Library2.qfl" SourceLine="-1" >
<Disp><![CDATA[password]]></Disp>
</NodeArgs>
</Step>
<NodeArgs eType="Context" icon="6" nRep="87" status="Failed" Source="D:\KeywordDrivenFramework\FunctionLibr\Library2.qfl" SourceLine="-1" >
<Disp><![CDATA[HPE MyFlight Sample Applicatio]]></Disp>
</NodeArgs>
</Step>
<Step rID="T42">
<Obj plainTxt="False" ><![CDATA[HPE MyFlight Sample Applicatio]]></Obj>
<Details plainTxt="False" ><![CDATA[WpfWindow]]></Details>
<Time><![CDATA[29/03/2022 - 23:04:59]]></Time>
<TimeTick>1648575299</TimeTick>
<Step rID="T43">
<Obj plainTxt="False" ><![CDATA[Run Error]]></Obj>
<Details plainTxt="False" ><![CDATA[Cannot find the &quot;password&quot; object's parent &quot;HPE MyFlight Sample Applicatio&quot; (class WpfWindow).<BR/>Verify that parent properties match an object currently displayed in your application.<BR/>Function file: D:\KeywordDrivenFramework\FunctionLibr\Library2.qfl<BR/>Line (5): &quot;WpfWindow(&quot;HPE MyFlight Sample Applicatio&quot;).WpfEdit(&quot;password&quot;).SetSecure &quot;6242a97c443fd0b29eca&quot;&quot;.]]></Details>
<Time><![CDATA[29/03/2022 - 23:04:59]]></Time>
<TimeTick>1648575299</TimeTick>
<NodeArgs eType="Replay" icon="5" nRep="102" status="Failed" Source="D:\KeywordDrivenFramework\FunctionLibr\Library2.qfl" SourceLine="4" >
<Disp><![CDATA[Run Error]]></Disp>
</NodeArgs>
</Step>
<Step rID="T44">
<Obj plainTxt="False" ><![CDATA[OK]]></Obj>
<Details plainTxt="False" ><![CDATA[Cannot&nbsp;find&nbsp;the&nbsp;"OK"&nbsp;object's&nbsp;parent&nbsp;"HPE&nbsp;MyFlight&nbsp;Sample&nbsp;Applicatio"&nbsp;(class&nbsp;WpfWindow).<br/>Verify&nbsp;that&nbsp;parent&nbsp;properties&nbsp;match&nbsp;an&nbsp;object&nbsp;currently&nbsp;displayed&nbsp;in&nbsp;your&nbsp;application.]]></Details>
<Time><![CDATA[29/03/2022 - 23:04:59]]></Time>
<TimeTick>1648575299</TimeTick>
<Step rID="T45">
<Obj plainTxt="False" ><![CDATA[HPE MyFlight Sample Applicatio]]></Obj>
<Details plainTxt="False" ><![CDATA[Object's physical description:<br>wpftypename = window<br>regexpwndtitle = HPE MyFlight Sample Application<br>devname = HPE MyFlight Sample Application<br>]]></Details>
<Time><![CDATA[29/03/2022 - 23:04:59]]></Time>
<TimeTick>1648575299</TimeTick>
<NodeArgs eType="Replay" icon="5" nRep="104" status="Warning" nType="Parent description" Source="D:\KeywordDrivenFramework\FunctionLibr\Library2.qfl" SourceLine="-1" >
<Disp><![CDATA[HPE MyFlight Sample Applicatio]]></Disp>
</NodeArgs>
</Step>